{
  "participantPseudonym": "peter_01",
  "language": "en",
  "documentRevision": "a3cf1deda0d9577817b2ffeb8078068f77f48340",
  "answeredAt": "2026-08-15T19:02:00+09:00",
  "consentConfirmed": true,
  "identifyingData": null,
  "answers": [
    {"questionId": "Q1", "rawAnswer": "AI Cockpit tries to make AI-assisted software work more trustworthy. The basic problem is that an AI agent can sound confident and say it finished something correctly, while the actual work may have gone outside the requested scope, skipped checks, weakened tests, or simply lack proof. It replaces ‘trust what the AI says’ with ‘look at the evidence.’", "confidence": "high", "score": "correct", "reviewerNote": "Explains the evidence-over-self-declaration problem in nontechnical terms."},
    {"questionId": "Q2", "rawAnswer": "The North Star is calibrated trust between humans and AI agents. In daily work, people should be able to see what was requested, what the AI did, what evidence supports it, what remains unknown, whether it is safe to continue, and whether a human decision is needed. Success is not simply more completed AI tasks.", "confidence": "high", "score": "correct", "reviewerNote": "States calibrated trust and its practical consequence."},
    {"questionId": "Q3", "rawAnswer": "AI Cockpit controls governance of work inside the repository: Work Items, boundaries, required evidence, verification results, and status. It is not the AI agent, a general orchestrator, or a security sandbox. Identity, branch protection, production isolation, signatures, vulnerability results, enterprise compliance, and human authority remain with the systems and people that own them.", "confidence": "high", "score": "correct", "reviewerNote": "Separates repository governance from external controls and human authority."},
    {"questionId": "Q4", "rawAnswer": "Green means current required evidence supports the next limited action, but not automatic merge or release. Yellow means evidence is missing, outdated, contradictory, or risky, so investigate. Red means a control failed, scope was exceeded, or authority is missing, so stop until it is resolved. Unknown means do not guess; obtain more information or clarification.", "confidence": "high", "score": "correct", "reviewerNote": "Correctly distinguishes continuation, investigation, stop, and unknown."},
    {"questionId": "Q5", "rawAnswer": "Do not start by asking AI to change code. First install and calibrate AI Cockpit for the actual project, start from the current trusted default branch, record that starting point, create the Work Item, review Preflight, and define allowed changes, exclusions, verification, and unknowns. Begin only after the boundaries and checks allow it.", "confidence": "high", "score": "correct", "reviewerNote": "Describes the first Work Item's trusted-base and Preflight sequence."},
    {"questionId": "Q6", "rawAnswer": "Treat missing evidence as a real gap. Stop or pause, identify exactly what is missing, obtain or repair it, and rerun the affected checks. Do not accept AI confidence as proof, invent evidence, reuse another task's evidence, ignore a failed check, or use human approval to convert a failed technical check into a pass. ‘We do not know yet’ is acceptable.", "confidence": "high", "score": "correct", "reviewerNote": "Accurately describes fail-closed recovery and prohibited substitutions."}
  ]
}
